{
  "schema_version": "2.0.0",
  "batch": {
    "batch_id": "batch_001",
    "created_at": "2026-10-26T10:00:00Z",
    "status": "review_required",
    "policy_version": "policy_1",
    "revision": 1
  },
  "source_files": [
    {
      "file_id": "file_001",
      "filename": "combined_100_pages.pdf",
      "media_type": "application/pdf",
      "sha256": "bb92d90de7d22a2811024d95d4048c341f44d1ef5ab36be0c806469b4612397a",
      "page_count": 100,
      "storage_ref": null
    }
  ],
  "pages": [
    {
      "file_id": "file_001",
      "page_number": 1,
      "width": 595,
      "height": 842,
      "rotation": 0,
      "status": "classified",
      "regions": [
        {
          "region_id": "r_doc_001_1",
          "document_id": "doc_001",
          "bbox": {
            "x": 0,
            "y": 0,
            "width": 1,
            "height": 1
          },
          "role": "full_page"
        }
      ],
      "unassigned_reason": null
    },
    {
      "file_id": "file_001",
      "page_number": 2,
      "width": 595,
      "height": 842,
      "rotation": 0,
      "status": "classified",
      "regions": [
        {
          "region_id": "r_doc_001_2",
          "document_id": "doc_001",
          "bbox": {
            "x": 0,
            "y": 0,
            "width": 1,
            "height": 1
          },
          "role": "full_page"
        }
      ],
      "unassigned_reason": null
    },
    {
      "file_id": "file_001",
      "page_number": 3,
      "width": 595,
      "height": 842,
      "rotation": 0,
      "status": "classified",
      "regions": [
        {
          "region_id": "r_doc_001_3",
          "document_id": "doc_001",
          "bbox": {
            "x": 0,
            "y": 0,
            "width": 1,
            "height": 1
          },
          "role": "full_page"
        }
      ],
      "unassigned_reason": null
    },
    {
      "file_id": "file_001",
      "page_number": 4,
      "width": 595,
      "height": 842,
      "rotation": 0,
      "status": "classified",
      "regions": [
        {
          "region_id": "r_doc_001_4",
          "document_id": "doc_001",
          "bbox": {
            "x": 0,
            "y": 0,
            "width": 1,
            "height": 1
          },
          "role": "full_page"
        }
      ],
      "unassigned_reason": null
    },
    {
      "file_id": "file_001",
      "page_number": 5,
      "width": 595,
      "height": 842,
      "rotation": 0,
      "status": "classified",
      "regions": [
        {
          "region_id": "r_doc_010_5",
          "document_id": "doc_010",
          "bbox": {
            "x": 0,
            "y": 0,
            "width": 1,
            "height": 1
          },
          "role": "full_page"
        }
      ],
      "unassigned_reason": null
    },
    {
      "file_id": "file_001",
      "page_number": 6,
      "width": 595,
      "height": 842,
      "rotation": 0,
      "status": "classified",
      "regions": [
        {
          "region_id": "r_doc_002_6",
          "document_id": "doc_002",
          "bbox": {
            "x": 0,
            "y": 0,
            "width": 1,
            "height": 1
          },
          "role": "full_page"
        }
      ],
      "unassigned_reason": null
    },
    {
      "file_id": "file_001",
      "page_number": 7,
      "width": 595,
      "height": 842,
      "rotation": 0,
      "status": "classified",
      "regions": [
        {
          "region_id": "r_doc_002_7",
          "document_id": "doc_002",
          "bbox": {
            "x": 0,
            "y": 0,
            "width": 1,
            "height": 1
          },
          "role": "full_page"
        }
      ],
      "unassigned_reason": null
    },
    {
      "file_id": "file_001",
      "page_number": 8,
      "width": 595,
      "height": 842,
      "rotation": 0,
      "status": "classified",
      "regions": [
        {
          "region_id": "r_doc_002_8",
          "document_id": "doc_002",
          "bbox": {
            "x": 0,
            "y": 0,
            "width": 1,
            "height": 1
          },
          "role": "full_page"
        }
      ],
      "unassigned_reason": null
    },
    {
      "file_id": "file_001",
      "page_number": 9,
      "width": 595,
      "height": 842,
      "rotation": 0,
      "status": "classified",
      "regions": [
        {
          "region_id": "r_doc_002_9",
          "document_id": "doc_002",
          "bbox": {
            "x": 0,
            "y": 0,
            "width": 1,
            "height": 1
          },
          "role": "full_page"
        }
      ],
      "unassigned_reason": null
    },
    {
      "file_id": "file_001",
      "page_number": 10,
      "width": 595,
      "height": 842,
      "rotation": 0,
      "status": "classified",
      "regions": [
        {
          "region_id": "r_doc_002_10",
          "document_id": "doc_002",
          "bbox": {
            "x": 0,
            "y": 0,
            "width": 1,
            "height": 1
          },
          "role": "full_page"
        }
      ],
      "unassigned_reason": null
    },
    {
      "file_id": "file_001",
      "page_number": 11,
      "width": 595,
      "height": 842,
      "rotation": 0,
      "status": "classified",
      "regions": [
        {
          "region_id": "r_doc_003_11",
          "document_id": "doc_003",
          "bbox": {
            "x": 0,
            "y": 0,
            "width": 1,
            "height": 1
          },
          "role": "full_page"
        }
      ],
      "unassigned_reason": null
    },
    {
      "file_id": "file_001",
      "page_number": 12,
      "width": 595,
      "height": 842,
      "rotation": 0,
      "status": "classified",
      "regions": [
        {
          "region_id": "r_doc_003_12",
          "document_id": "doc_003",
          "bbox": {
            "x": 0,
            "y": 0,
            "width": 1,
            "height": 1
          },
          "role": "full_page"
        }
      ],
      "unassigned_reason": null
    },
    {
      "file_id": "file_001",
      "page_number": 13,
      "width": 595,
      "height": 842,
      "rotation": 0,
      "status": "classified",
      "regions": [
        {
          "region_id": "r_doc_003_13",
          "document_id": "doc_003",
          "bbox": {
            "x": 0,
            "y": 0,
            "width": 1,
            "height": 1
          },
          "role": "full_page"
        }
      ],
      "unassigned_reason": null
    },
    {
      "file_id": "file_001",
      "page_number": 14,
      "width": 595,
      "height": 842,
      "rotation": 0,
      "status": "classified",
      "regions": [
        {
          "region_id": "r_doc_003_14",
          "document_id": "doc_003",
          "bbox": {
            "x": 0,
            "y": 0,
            "width": 1,
            "height": 1
          },
          "role": "full_page"
        }
      ],
      "unassigned_reason": null
    },
    {
      "file_id": "file_001",
      "page_number": 15,
      "width": 595,
      "height": 842,
      "rotation": 0,
      "status": "classified",
      "regions": [
        {
          "region_id": "r_doc_003_15",
          "document_id": "doc_003",
          "bbox": {
            "x": 0,
            "y": 0,
            "width": 1,
            "height": 1
          },
          "role": "full_page"
        }
      ],
      "unassigned_reason": null
    },
    {
      "file_id": "file_001",
      "page_number": 16,
      "width": 595,
      "height": 842,
      "rotation": 0,
      "status": "classified",
      "regions": [
        {
          "region_id": "r_doc_004_16",
          "document_id": "doc_004",
          "bbox": {
            "x": 0,
            "y": 0,
            "width": 1,
            "height": 1
          },
          "role": "full_page"
        }
      ],
      "unassigned_reason": null
    },
    {
      "file_id": "file_001",
      "page_number": 17,
      "width": 595,
      "height": 842,
      "rotation": 0,
      "status": "classified",
      "regions": [
        {
          "region_id": "r_doc_004_17",
          "document_id": "doc_004",
          "bbox": {
            "x": 0,
            "y": 0,
            "width": 1,
            "height": 1
          },
          "role": "full_page"
        }
      ],
      "unassigned_reason": null
    },
    {
      "file_id": "file_001",
      "page_number": 18,
      "width": 595,
      "height": 842,
      "rotation": 0,
      "status": "classified",
      "regions": [
        {
          "region_id": "r_doc_004_18",
          "document_id": "doc_004",
          "bbox": {
            "x": 0,
            "y": 0,
            "width": 1,
            "height": 1
          },
          "role": "full_page"
        }
      ],
      "unassigned_reason": null
    },
    {
      "file_id": "file_001",
      "page_number": 19,
      "width": 595,
      "height": 842,
      "rotation": 0,
      "status": "classified",
      "regions": [
        {
          "region_id": "r_doc_004_19",
          "document_id": "doc_004",
          "bbox": {
            "x": 0,
            "y": 0,
            "width": 1,
            "height": 1
          },
          "role": "full_page"
        }
      ],
      "unassigned_reason": null
    },
    {
      "file_id": "file_001",
      "page_number": 20,
      "width": 595,
      "height": 842,
      "rotation": 0,
      "status": "classified",
      "regions": [
        {
          "region_id": "r_doc_004_20",
          "document_id": "doc_004",
          "bbox": {
            "x": 0,
            "y": 0,
            "width": 1,
            "height": 1
          },
          "role": "full_page"
        }
      ],
      "unassigned_reason": null
    },
    {
      "file_id": "file_001",
      "page_number": 21,
      "width": 595,
      "height": 842,
      "rotation": 0,
      "status": "classified",
      "regions": [
        {